{
  "$schema": "https://json-schema.org/draft/2020-12/schema",
  "$id": "urn:elite:business-policy:v1",
  "$comment": "AUTHORED compatibility sidecar to PBC-CORE/1.0.0. The authoritative Go loader additionally rejects duplicate/case-aliased keys, invalid UTF-8, more than16384 bytes, minimum capacity greater than maximum, and bytes not matching the independently selected lowercase SHA-256.",
  "type": "object",
  "additionalProperties": false,
  "required": [
    "schema",
    "extends",
    "profile_id",
    "revision",
    "appointments",
    "pricebooks"
  ],
  "properties": {
    "schema": {
      "const": "elite-business-policy/v1"
    },
    "extends": {
      "const": "PBC-CORE/1.0.0"
    },
    "profile_id": {
      "type": "string",
      "pattern": "^[a-z][a-z0-9_-]{1,63}$"
    },
    "revision": {
      "type": "integer",
      "minimum": 1,
      "maximum": 9223372036854775807
    },
    "appointments": {
      "type": "object",
      "additionalProperties": false,
      "required": [
        "lead_time_seconds",
        "maximum_slot_seconds",
        "minimum_slot_capacity",
        "maximum_slot_capacity",
        "occupying_states",
        "working_window",
        "unavailable_window"
      ],
      "properties": {
        "lead_time_seconds": {
          "type": "integer",
          "minimum": 0,
          "maximum": 9223372036
        },
        "maximum_slot_seconds": {
          "type": "integer",
          "minimum": 1,
          "maximum": 28800
        },
        "minimum_slot_capacity": {
          "type": "integer",
          "minimum": 1,
          "maximum": 100
        },
        "maximum_slot_capacity": {
          "type": "integer",
          "minimum": 1,
          "maximum": 100
        },
        "occupying_states": {
          "const": [
            "requested",
            "confirmed"
          ]
        },
        "working_window": {
          "const": "contains_slot"
        },
        "unavailable_window": {
          "const": "reject_overlap"
        }
      }
    },
    "pricebooks": {
      "type": "object",
      "additionalProperties": false,
      "required": [
        "selection",
        "validity"
      ],
      "properties": {
        "selection": {
          "const": "single_active_per_market_currency"
        },
        "validity": {
          "const": "half_open"
        }
      }
    }
  }
}
